{
  "observation_id": "observation:m87:ring-scale-structure",
  "description": "Calibrated 2017 EHT visibility and closure measurements contain horizon-scale structure from the compact radio source at the center of M87; image-domain ring morphology is a downstream reconstruction, not a direct detector frame.",
  "observed_at": "2017-04-11T00:00:00Z",
  "instrument_ref": "instrument:eht:network",
  "source_hash": "9134b5f261bd6936d9e25547eca722be89b325b587fe22d06ba980b0de31a896",
  "data_uri": "https://github.com/eventhorizontelescope/2019-D01-01/tree/27ae76aacb9067a83388395c3826012b97aac371",
  "band_or_channel": "1.3 mm / approximately 230 GHz",
  "uncertainty": {
    "description": "The official EHT Git release pinned to commit 27ae76aacb9067a83388395c3826012b97aac371 was ingested and hashed by Vajra. Scientific calibration claims and byte-for-byte equivalence with the CyVerse DOI endpoint remain to be independently reproduced.",
    "value": null,
    "unit": null
  }
}
